[
  {
    "entity_id": "contact-001",
    "fields": { "name": "Alice Smith", "phone": "+1-555-0101" },
    "deleted": false,
    "last_modified": "2024-01-15T10:00:05Z",
    "last_source": "local"
  },
  {
    "entity_id": "contact-002",
    "fields": { "name": "Bob Jones", "phone": "+1-555-0102" },
    "deleted": false,
    "last_modified": "2024-01-15T10:01:05Z",
    "last_source": "local"
  },
  {
    "entity_id": "contact-003",
    "fields": { "name": "Carol White", "phone": "+1-555-0103" },
    "deleted": false,
    "last_modified": "2024-01-15T10:02:05Z",
    "last_source": "local"
  },
  {
    "entity_id": "contact-004",
    "fields": { "name": "David Brown", "phone": "+1-555-0104" },
    "deleted": false,
    "last_modified": "2024-01-15T10:03:05Z",
    "last_source": "local"
  },
  {
    "entity_id": "contact-005",
    "fields": { "name": "Eve Davis", "phone": "+1-555-0105" },
    "deleted": false,
    "last_modified": "2024-01-15T10:04:05Z",
    "last_source": "local"
  },
  {
    "entity_id": "contact-006",
    "fields": { "email": "frank@example.com", "name": "Frank Miller" },
    "deleted": false,
    "last_modified": "2024-01-15T10:05:10Z",
    "last_source": "remote"
  },
  {
    "entity_id": "contact-007",
    "fields": { "email": "grace@example.com", "name": "Grace Wilson" },
    "deleted": false,
    "last_modified": "2024-01-15T10:06:10Z",
    "last_source": "remote"
  },
  {
    "entity_id": "contact-008",
    "fields": { "email": "henry@example.com", "name": "Henry Taylor" },
    "deleted": false,
    "last_modified": "2024-01-15T10:07:10Z",
    "last_source": "remote"
  },
  {
    "entity_id": "contact-009",
    "fields": { "email": "iris@example.com", "name": "Iris Anderson" },
    "deleted": false,
    "last_modified": "2024-01-15T10:08:10Z",
    "last_source": "remote"
  },
  {
    "entity_id": "contact-010",
    "fields": { "email": "jack@example.com", "name": "Jack Thomas" },
    "deleted": false,
    "last_modified": "2024-01-15T10:09:10Z",
    "last_source": "remote"
  }
]
