[
  {
    "entity_id": "contact-001",
    "fields": { "name": "Remote Name 1", "phone": "+1-555-0001" },
    "deleted": false,
    "last_modified": "2024-01-15T10:01:40Z",
    "last_source": "remote"
  },
  {
    "entity_id": "contact-002",
    "fields": { "name": "Remote Name 2", "phone": "+1-555-0002" },
    "deleted": false,
    "last_modified": "2024-01-15T10:01:40Z",
    "last_source": "remote"
  },
  {
    "entity_id": "contact-003",
    "fields": { "name": "Remote Name 3", "phone": "+1-555-0003" },
    "deleted": false,
    "last_modified": "2024-01-15T10:01:40Z",
    "last_source": "remote"
  },
  {
    "entity_id": "contact-004",
    "fields": { "name": "Remote Name 4", "phone": "+1-555-0004" },
    "deleted": false,
    "last_modified": "2024-01-15T10:01:40Z",
    "last_source": "remote"
  },
  {
    "entity_id": "contact-005",
    "fields": { "name": "Remote Name 5", "phone": "+1-555-0005" },
    "deleted": false,
    "last_modified": "2024-01-15T10:01:40Z",
    "last_source": "remote"
  },
  {
    "entity_id": "contact-006",
    "fields": { "email": "local6@example.com", "name": "Only Local 6" },
    "deleted": false,
    "last_modified": "2024-01-15T10:01:55Z",
    "last_source": "local"
  },
  {
    "entity_id": "contact-007",
    "fields": { "email": "local7@example.com", "name": "Only Local 7" },
    "deleted": false,
    "last_modified": "2024-01-15T10:02:05Z",
    "last_source": "local"
  },
  {
    "entity_id": "contact-008",
    "fields": { "email": "local8@example.com", "name": "Only Local 8" },
    "deleted": false,
    "last_modified": "2024-01-15T10:02:15Z",
    "last_source": "local"
  },
  {
    "entity_id": "contact-009",
    "fields": { "email": "local9@example.com", "name": "Only Local 9" },
    "deleted": false,
    "last_modified": "2024-01-15T10:02:25Z",
    "last_source": "local"
  },
  {
    "entity_id": "contact-010",
    "fields": { "email": "local10@example.com", "name": "Only Local 10" },
    "deleted": false,
    "last_modified": "2024-01-15T10:02:35Z",
    "last_source": "local"
  },
  {
    "entity_id": "contact-011",
    "fields": { "name": "Resurrected Contact" },
    "deleted": false,
    "last_modified": "2024-01-15T10:04:20Z",
    "last_source": "remote"
  },
  {
    "entity_id": "contact-012",
    "fields": { "address": "", "name": "Empty Address Person" },
    "deleted": false,
    "last_modified": "2024-01-15T10:01:45Z",
    "last_source": "local"
  },
  {
    "entity_id": "contact-013",
    "fields": { "address": "13 Full Street", "email": "complete13@example.com", "name": "Complete 13", "phone": "+1-555-0013" },
    "deleted": false,
    "last_modified": "2024-01-15T10:01:26Z",
    "last_source": "remote"
  },
  {
    "entity_id": "contact-014",
    "fields": { "address": "14 Full Street", "email": "complete14@example.com", "name": "Complete 14", "phone": "+1-555-0014" },
    "deleted": false,
    "last_modified": "2024-01-15T10:01:27Z",
    "last_source": "remote"
  },
  {
    "entity_id": "contact-015",
    "fields": { "address": "15 Full Street", "email": "complete15@example.com", "name": "Complete 15", "phone": "+1-555-0015" },
    "deleted": false,
    "last_modified": "2024-01-15T10:01:28Z",
    "last_source": "remote"
  },
  {
    "entity_id": "contact-016",
    "fields": { "name": "Multi-Update 16", "phone": "+1-555-NEW-16" },
    "deleted": false,
    "last_modified": "2024-01-15T10:03:10Z",
    "last_source": "local"
  },
  {
    "entity_id": "contact-017",
    "fields": { "name": "Multi-Update 17", "phone": "+1-555-NEW-17" },
    "deleted": false,
    "last_modified": "2024-01-15T10:03:20Z",
    "last_source": "local"
  },
  {
    "entity_id": "contact-018",
    "fields": { "name": "Multi-Update 18", "phone": "+1-555-NEW-18" },
    "deleted": false,
    "last_modified": "2024-01-15T10:03:30Z",
    "last_source": "local"
  },
  {
    "entity_id": "contact-019",
    "fields": { "name": "Multi-Update 19", "phone": "+1-555-NEW-19" },
    "deleted": false,
    "last_modified": "2024-01-15T10:03:40Z",
    "last_source": "local"
  },
  {
    "entity_id": "contact-020",
    "fields": { "name": "Multi-Update 20", "phone": "+1-555-NEW-20" },
    "deleted": false,
    "last_modified": "2024-01-15T10:03:50Z",
    "last_source": "local"
  }
]
