[
  {
    "entity_id": "contact-001",
    "fields": { "email": "person001@example.com", "name": "Person 001", "phone": "+1-555-1001" },
    "deleted": false,
    "last_modified": "2024-01-15T10:00:40Z",
    "last_source": "local"
  },
  {
    "entity_id": "contact-002",
    "fields": { "email": "person002@example.com", "name": "Person 002", "phone": "+1-555-1002" },
    "deleted": false,
    "last_modified": "2024-01-15T10:01:10Z",
    "last_source": "local"
  },
  {
    "entity_id": "contact-003",
    "fields": { "email": "person003@example.com", "name": "Person 003", "phone": "+1-555-1003" },
    "deleted": false,
    "last_modified": "2024-01-15T10:01:40Z",
    "last_source": "local"
  },
  {
    "entity_id": "contact-004",
    "fields": { "email": "person004@example.com", "name": "Person 004", "phone": "+1-555-1004" },
    "deleted": false,
    "last_modified": "2024-01-15T10:02:10Z",
    "last_source": "local"
  },
  {
    "entity_id": "contact-005",
    "fields": { "email": "person005@example.com", "name": "Person 005", "phone": "+1-555-1005" },
    "deleted": false,
    "last_modified": "2024-01-15T10:02:40Z",
    "last_source": "local"
  },
  {
    "entity_id": "contact-006",
    "fields": { "email": "person006@example.com", "name": "Person 006", "phone": "+1-555-1006" },
    "deleted": false,
    "last_modified": "2024-01-15T10:03:10Z",
    "last_source": "local"
  },
  {
    "entity_id": "contact-007",
    "fields": { "email": "person007@example.com", "name": "Person 007", "phone": "+1-555-1007" },
    "deleted": false,
    "last_modified": "2024-01-15T10:03:40Z",
    "last_source": "local"
  },
  {
    "entity_id": "contact-008",
    "fields": { "email": "person008@example.com", "name": "Person 008", "phone": "+1-555-1008" },
    "deleted": false,
    "last_modified": "2024-01-15T10:04:10Z",
    "last_source": "local"
  },
  {
    "entity_id": "contact-009",
    "fields": { "email": "person009@example.com", "name": "Person 009", "phone": "+1-555-1009" },
    "deleted": false,
    "last_modified": "2024-01-15T10:04:40Z",
    "last_source": "local"
  },
  {
    "entity_id": "contact-010",
    "fields": { "email": "person010@example.com", "name": "Person 010", "phone": "+1-555-1010" },
    "deleted": false,
    "last_modified": "2024-01-15T10:05:10Z",
    "last_source": "local"
  },
  {
    "entity_id": "contact-011",
    "fields": { "address": "111 Main St", "name": "Person 011" },
    "deleted": false,
    "last_modified": "2024-01-15T10:00:40Z",
    "last_source": "remote"
  },
  {
    "entity_id": "contact-012",
    "fields": { "address": "112 Main St", "name": "Person 012" },
    "deleted": false,
    "last_modified": "2024-01-15T10:01:10Z",
    "last_source": "remote"
  },
  {
    "entity_id": "contact-013",
    "fields": { "address": "113 Main St", "name": "Person 013" },
    "deleted": false,
    "last_modified": "2024-01-15T10:01:40Z",
    "last_source": "remote"
  },
  {
    "entity_id": "contact-014",
    "fields": { "address": "114 Main St", "name": "Person 014" },
    "deleted": false,
    "last_modified": "2024-01-15T10:02:10Z",
    "last_source": "remote"
  },
  {
    "entity_id": "contact-015",
    "fields": { "address": "115 Main St", "name": "Person 015" },
    "deleted": false,
    "last_modified": "2024-01-15T10:02:40Z",
    "last_source": "remote"
  },
  {
    "entity_id": "contact-016",
    "fields": { "address": "116 Main St", "name": "Person 016" },
    "deleted": false,
    "last_modified": "2024-01-15T10:03:10Z",
    "last_source": "remote"
  },
  {
    "entity_id": "contact-017",
    "fields": { "address": "117 Main St", "name": "Person 017" },
    "deleted": false,
    "last_modified": "2024-01-15T10:03:40Z",
    "last_source": "remote"
  },
  {
    "entity_id": "contact-018",
    "fields": { "address": "118 Main St", "name": "Person 018" },
    "deleted": false,
    "last_modified": "2024-01-15T10:04:10Z",
    "last_source": "remote"
  },
  {
    "entity_id": "contact-019",
    "fields": { "address": "119 Main St", "name": "Person 019" },
    "deleted": false,
    "last_modified": "2024-01-15T10:04:40Z",
    "last_source": "remote"
  },
  {
    "entity_id": "contact-020",
    "fields": { "address": "120 Main St", "name": "Person 020" },
    "deleted": false,
    "last_modified": "2024-01-15T10:05:10Z",
    "last_source": "remote"
  },
  {
    "entity_id": "contact-021",
    "fields": { "name": "Person 021", "phone": "+1-555-1021" },
    "deleted": false,
    "last_modified": "2024-01-15T10:01:30Z",
    "last_source": "remote"
  },
  {
    "entity_id": "contact-022",
    "fields": { "name": "Person 022", "phone": "+1-555-1022" },
    "deleted": false,
    "last_modified": "2024-01-15T10:02:30Z",
    "last_source": "remote"
  },
  {
    "entity_id": "contact-023",
    "fields": { "name": "Person 023", "phone": "+1-555-1023" },
    "deleted": false,
    "last_modified": "2024-01-15T10:03:30Z",
    "last_source": "remote"
  },
  {
    "entity_id": "contact-024",
    "fields": { "name": "Person 024", "phone": "+1-555-1024" },
    "deleted": false,
    "last_modified": "2024-01-15T10:04:30Z",
    "last_source": "remote"
  },
  {
    "entity_id": "contact-025",
    "fields": { "name": "Person 025", "phone": "+1-555-1025" },
    "deleted": false,
    "last_modified": "2024-01-15T10:05:30Z",
    "last_source": "remote"
  },
  {
    "entity_id": "contact-026",
    "fields": { "name": "Person 026", "phone": "+1-555-1026" },
    "deleted": false,
    "last_modified": "2024-01-15T10:06:30Z",
    "last_source": "remote"
  },
  {
    "entity_id": "contact-027",
    "fields": { "name": "Person 027", "phone": "+1-555-1027" },
    "deleted": false,
    "last_modified": "2024-01-15T10:07:30Z",
    "last_source": "remote"
  },
  {
    "entity_id": "contact-028",
    "fields": { "name": "Person 028", "phone": "+1-555-1028" },
    "deleted": false,
    "last_modified": "2024-01-15T10:08:30Z",
    "last_source": "remote"
  },
  {
    "entity_id": "contact-029",
    "fields": { "name": "Person 029", "phone": "+1-555-1029" },
    "deleted": true,
    "last_modified": "2024-01-15T10:15:00Z",
    "last_source": "local"
  },
  {
    "entity_id": "contact-030",
    "fields": { "name": "Person 030", "phone": "+1-555-1030" },
    "deleted": true,
    "last_modified": "2024-01-15T10:15:10Z",
    "last_source": "remote"
  }
]
